{
  "id": "craft", "name": "02 创作 · 让细节发光", "durationFrames": 180,
  "program": { "entry": "scripts/craft.ts", "renderer": "2d", "seed": 20261003, "params": { "accent": "#75efd3", "secondary": "#a58aff", "energy": 1 } },
  "layers": [
    {
      "id": "craft-title", "name": "第二幕标题", "type": "text", "text": "把想法拆开，\n让细节发光。",
      "fontFamily": "Microsoft YaHei", "fontSize": 84, "fontWeight": 700, "textAlign": "left", "lineHeight": 1.3, "color": "#f0f7fc",
      "startFrame": 0, "endFrame": 180, "x": 620, "y": 327, "width": 920, "height": 235, "scaleX": 1, "scaleY": 1, "rotation": 0, "opacity": 1, "visible": true,
      "keyframes": { "y": [{ "frame": 0, "value": 352, "easing": [0.22, 1, 0.36, 1] }, { "frame": 28, "value": 327 }], "opacity": [{ "frame": 0, "value": 0 }, { "frame": 20, "value": 1 }] }
    },
    {
      "id": "craft-subtitle", "name": "创作文案", "type": "text", "text": "节奏、层次、色彩，组成你的表达。",
      "fontFamily": "Microsoft YaHei", "fontSize": 30, "textAlign": "left", "color": "#a2b9cd",
      "startFrame": 0, "endFrame": 180, "x": 650, "y": 492, "width": 980, "height": 64, "scaleX": 1, "scaleY": 1, "rotation": 0, "opacity": 1, "visible": true,
      "keyframes": { "opacity": [{ "frame": 10, "value": 0 }, { "frame": 36, "value": 1 }] }
    }
  ]
}
